{
  "schemaVersion": "3.0.0",
  "asOf": "2026-10-16",
  "status": "Independent conditional design matrix; no government/UN/OSCE/IAEA endorsement or live monitoring",
  "trackDefinitions": [
    {
      "id": "t1",
      "title": "Track 1 — Kinetic de-escalation & nuclear/civilian security",
      "scope": "Mutual restraint, protected-person obligations, policy-level arms separation and qualified incident review. No tactical deployment data.",
      "decisionOwners": [
        "Ukrainian competent authorities",
        "Russian competent authorities",
        "separately accepting independent monitors"
      ],
      "nondelegable": "No research tool can impose ceasefires, compel access, or task an international organization without its authorization."
    },
    {
      "id": "t2",
      "title": "Track 2 — Governance, law & rights",
      "scope": "Territorial integrity, lawful interim governance, voluntary participation, displaced-person rights, minority/language protections, and constitutionally lawful institutions.",
      "decisionOwners": [
        "Ukraine under its constitutional system",
        "other formally empowered parties when required",
        "relevant international body within a valid mandate"
      ],
      "nondelegable": "A five-year wait does not legalize occupied-territory plebiscites, and the UN does not assume administration automatically."
    },
    {
      "id": "t3",
      "title": "Track 3 — Economic & ecological recovery",
      "scope": "Lawful finance, open contracting, grid resilience, human-supervised mine action, civilian shipping and community-led ecological restoration.",
      "decisionOwners": [
        "Ukraine and competent subnational authorities",
        "fund administrators",
        "grid operators",
        "national mine-action authorities"
      ],
      "nondelegable": "Assets, power transfers and safety certification depend on legal authority and independently verifiable operating capacity."
    }
  ],
  "phases": [
    {
      "id": "p1",
      "title": "Phase 1 — Documented humanitarian restraint & verifiable ceasefire options",
      "objective": "Generate limited, testable protection arrangements with evidenced consent and a credible incident dispute mechanism.",
      "entryConditions": [
        "Separate identification of Ukrainian/Russian empowered counterparts for bilateral restraints",
        "Written scope, protected-person safety, IHL review",
        "Identified verifier and access/communications mandate, not presumed"
      ],
      "exitCriteria": [
        "Independent record of time-bound observed compliance with publicly defined caveats",
        "Contested incidents classified and adjudication route tested",
        "No unsupported claim of enforceable peace"
      ],
      "fallback": "Maintain lawful unilateral civilian protection, ICRC-compatible engagement, evidence collection and non-escalatory repair coordination."
    },
    {
      "id": "p2",
      "title": "Phase 2 — Lawful governance alternatives & contested-status safeguards",
      "objective": "Review lawful temporary arrangements, services and rights without prejudicing Ukraine’s internationally recognized borders.",
      "entryConditions": [
        "Ukrainian constitutional/sovereignty review",
        "Independent displacement and non-coercion assessment",
        "Mandate competence and explicit international institutional acceptance"
      ],
      "exitCriteria": [
        "Human-rights protections have named competent implementers and remedy channels",
        "Any status mechanism passes an independent legality test before further design",
        "Affected communities consulted without pressure"
      ],
      "fallback": "Use locally lawful public services, language protections and verified voluntary return programmes without administering occupied territory or proposing premature ballots."
    },
    {
      "id": "p3",
      "title": "Phase 3 — Accountable regenerative reconstruction",
      "objective": "Fund, govern, evaluate and maintain safe civilian recovery with independently verified public value.",
      "entryConditions": [
        "Lawful funds and budget approvals",
        "Local consent, land tenure, environment and procurement due diligence",
        "Accredited technical implementers and independent auditing"
      ],
      "exitCriteria": [
        "Audited public service delivery and measured availability",
        "Certified land release and independent safety inspection",
        "Published, privacy-safe ecological outcomes and maintenance plans"
      ],
      "fallback": "Defer unsafe projects, maintain humanitarian assistance, publish audit exceptions and redirect to legally available lower-risk alternatives."
    }
  ],
  "pathways": [
    {
      "id": "path-verified-ceasefire",
      "title": "Verified cessation-of-hostilities option",
      "trackId": "t1",
      "phaseId": "p1",
      "solutionIds": [
        "verified-ceasefire"
      ],
      "hypothesis": "Develop a conditional, civilian-protection-centred monitoring and incident-resolution framework; no automatic enforcement.",
      "mechanisms": [
        "Negotiate public definitions of covered conduct and synchronized effective time.",
        "Approve monitoring scope and safeguards; review telemetry handling at an aggregate level.",
        "Run a synthetic incident-dispute exercise before any live claims."
      ],
      "preconditions": [
        "documented reciprocal consent",
        "bounded and public mandate",
        "independent monitor safety/access"
      ],
      "riskMitigations": [
        {
          "risk": "No valid monitor mandate",
          "mitigation": "Alternative agreed civilian-access monitoring or defer verification label",
          "stopOrReviewTrigger": "No approved mandate"
        },
        {
          "risk": "Monitoring could aid targeting",
          "mitigation": "Protect granular sensor data; publish only delayed aggregated results",
          "stopOrReviewTrigger": "Disclosure or unauthorized access"
        }
      ],
      "metricIds": [
        "verified_incidents",
        "access_denial"
      ],
      "sourceIds": [
        "osce-mandate-ended",
        "un-charter"
      ],
      "vetoPoints": [
        "lack of valid legal basis",
        "absent Ukrainian consent where required",
        "absent Russian consent where required",
        "unaccepted international mandates",
        "monitor access denial",
        "unfunded delivery",
        "civilian safety failure"
      ],
      "incentiveTests": [
        {
          "actor": "Ukraine",
          "question": "Does this improve civilian protection and security without prejudicing lawful sovereignty, and who has competence to decide?"
        },
        {
          "actor": "Russia",
          "question": "Which verifiable obligations and reciprocal concessions, if any, would be acceptable to competent authorities, without asserting willingness?"
        },
        {
          "actor": "Independent implementer",
          "question": "Does the organization have mandate, safe access, funds, and incentive to accept role?"
        }
      ],
      "fallback": "Maintain civilian protections without pretending a multilateral instrument exists.",
      "reviewStatus": "Unverified analytical proposal"
    },
    {
      "id": "path-sensor-verification",
      "title": "Consent-based ceasefire sensor and telemetry governance",
      "trackId": "t1",
      "phaseId": "p1",
      "solutionIds": [
        "sensor-verification"
      ],
      "hypothesis": "Feasibility study of electronic acoustic/seismic sensing and protected drone-derived metadata; not a live sensor grid.",
      "mechanisms": [
        "Define lawful remote-monitoring purpose, data minimization and chain of custody.",
        "Trial only simulated or non-sensitive sensor data with quantified false alarms.",
        "Determine admissibility and contestability of evidence."
      ],
      "preconditions": [
        "monitor acceptance and legal authority",
        "host-country and access consent",
        "data governance and protection impact assessment"
      ],
      "riskMitigations": [
        {
          "risk": "Sensor metadata can expose persons or military sites",
          "mitigation": "No public raw data, sensitive locations or live drone telemetry",
          "stopOrReviewTrigger": "Any targeting or deanonymization risk"
        }
      ],
      "metricIds": [
        "sensor_precision",
        "incident_timeliness"
      ],
      "sourceIds": [
        "osce-mandate-ended",
        "un-charter"
      ],
      "vetoPoints": [
        "lack of valid legal basis",
        "absent Ukrainian consent where required",
        "absent Russian consent where required",
        "unaccepted international mandates",
        "monitor access denial",
        "unfunded delivery",
        "civilian safety failure"
      ],
      "incentiveTests": [
        {
          "actor": "Ukraine",
          "question": "Does this improve civilian protection and security without prejudicing lawful sovereignty, and who has competence to decide?"
        },
        {
          "actor": "Russia",
          "question": "Which verifiable obligations and reciprocal concessions, if any, would be acceptable to competent authorities, without asserting willingness?"
        },
        {
          "actor": "Independent implementer",
          "question": "Does the organization have mandate, safe access, funds, and incentive to accept role?"
        }
      ],
      "fallback": "Maintain civilian protections without pretending a multilateral instrument exists.",
      "reviewStatus": "Unverified analytical proposal"
    },
    {
      "id": "path-artillery-separation-30km",
      "title": "30 km heavy-artillery separation hypothesis",
      "trackId": "t1",
      "phaseId": "p1",
      "solutionIds": [
        "artillery-separation-30km"